{
  "version": 1,
  "schema_version": 1,
  "pipeline_version": "v6",
  "date": "2025-11-04",
  "generated_at": "2025-11-04T03:01:21.327Z",
  "updated_at": "2025-11-04T03:01:21.327Z",
  "items": [
    {
      "id": "nvidia/parakeet-tdt-0.6b-v2",
      "canonical_id": "huggingface:nvidia/parakeet-tdt-0.6b-v2",
      "source": "huggingface",
      "status": "qualified",
      "name": "parakeet-tdt-0.6b-v2",
      "url": "https://huggingface.co/nvidia/parakeet-tdt-0.6b-v2",
      "tags": [
        "nemo",
        "automatic-speech-recognition",
        "speech",
        "audio",
        "Transducer",
        "TDT",
        "FastConformer",
        "Conformer",
        "pytorch",
        "NeMo",
        "hf-asr-leaderboard",
        "en",
        "dataset:nvidia/Granary",
        "dataset:nvidia/nemo-asr-set-3.0",
        "arxiv:2305.05084",
        "arxiv:2304.06795",
        "arxiv:2406.00899",
        "arxiv:2410.01036",
        "arxiv:2505.13404",
        "license:cc-by-4.0",
        "model-index",
        "region:us"
      ],
      "stats": {
        "downloads_total": 2360846,
        "likes_total": 1350
      },
      "summary": "Parakeet-TDT-0.6B-v2是NVIDIA开发的高效语音识别模型，专注于将语音实时转换为文本，解决实时交互应用的延迟问题。其技术核心采用Transducer-Decoder-Transducer架构和FastConformer模块，在保持高精度的同时显著降低计算开销。该模型可直接用于构建语音助手、实时字幕系统或音频转录工具，开发者可通过Hugging Face接口快速集成，并针对特定领域音频数据进行微调以获得更优性能。",
      "summary_en": "Parakeet-TDT-0.6B-v2 is NVIDIA's efficient speech recognition model that converts spoken audio to text with minimal latency, ideal for real-time applications. It employs Transducer-Decoder-Transducer (TDT) architecture and FastConformer modules to achieve high accuracy while maintaining computational efficiency. You can integrate it into voice assistants, transcription services, or live captioning systems using Hugging Face pipelines, and fine-tune it on domain-specific audio data for specialized use cases.",
      "summary_zh": "Parakeet-TDT-0.6B-v2是NVIDIA开发的高效语音识别模型，专注于将语音实时转换为文本，解决实时交互应用的延迟问题。其技术核心采用Transducer-Decoder-Transducer架构和FastConformer模块，在保持高精度的同时显著降低计算开销。该模型可直接用于构建语音助手、实时字幕系统或音频转录工具，开发者可通过Hugging Face接口快速集成，并针对特定领域音频数据进行微调以获得更优性能。",
      "summary_es": "Parakeet-TDT-0.6B-v2 is NVIDIA's efficient speech recognition model that converts spoken audio to text with minimal latency, ideal for real-time applications. It employs Transducer-Decoder-Transducer (TDT) architecture and FastConformer modules to achieve high accuracy while maintaining computational efficiency. You can integrate it into voice assistants, transcription services, or live captioning systems using Hugging Face pipelines, and fine-tune it on domain-specific audio data for specialized use cases.",
      "summary_short": {
        "zh": "Parakeet-TDT-0.6B-v2是NVIDIA开发的高效语音识别模型，专注于将语音实时转换为文本，解决实时交互应用的延迟问题。其技术核心采用Transducer-Decoder-Transducer架构和FastConformer模块，在保持高精度的同时显著降低计算开销。该模型可直接用于构建语音助手、实时字幕系统或音频转录工具，开发者可通过Hugging Face接口快速集成，并针对特定领域音频数据进行微调以获得更优性能。",
        "en": "Parakeet-TDT-0.6B-v2 is NVIDIA's efficient speech recognition model that converts spoken audio to text with minimal latency, ideal for real-time applications. It employs Transducer-Decoder-Transducer (TDT) architecture and FastConformer modules to achieve high accuracy while mai…",
        "es": "Parakeet-TDT-0.6B-v2 is NVIDIA's efficient speech recognition model that converts spoken audio to text with minimal latency, ideal for real-time applications. It employs Transducer-Decoder-Transducer (TDT) architecture and FastConformer modules to achieve high accuracy while mai…"
      },
      "tasks": [
        "asr"
      ],
      "project_categories": [],
      "first_seen": "2025-11-04T03:00:23.596Z",
      "last_seen": "2025-11-04T03:00:23.596Z",
      "created_at": "2025-11-04T03:00:23.596Z",
      "updated_at": "2025-11-04T03:00:23.596Z",
      "score": 2360846,
      "score_model": 2360846,
      "score_task": 1,
      "reason_label": "tri",
      "reason_text": "LLM-qualified summary"
    },
    {
      "id": "deepseek-ai/DeepSeek-OCR",
      "canonical_id": "huggingface:deepseek-ai/DeepSeek-OCR",
      "source": "huggingface",
      "status": "qualified",
      "name": "DeepSeek-OCR",
      "url": "https://huggingface.co/deepseek-ai/DeepSeek-OCR",
      "tags": [
        "transformers",
        "safetensors",
        "deepseek_vl_v2",
        "feature-extraction",
        "deepseek",
        "vision-language",
        "ocr",
        "custom_code",
        "conversational",
        "image-text-to-text",
        "multilingual",
        "arxiv:2510.18234",
        "license:mit",
        "region:us"
      ],
      "stats": {
        "downloads_total": 2057180,
        "likes_total": 2420
      },
      "summary": "DeepSeek-OCR 是一个先进的视觉语言模型，专门解决从图像中提取和理解文本的难题。它通过结合Transformer架构与优化的OCR技术，能够准确识别各种复杂布局和多语言文本。该模型采用端到端的视觉语言理解方法，在保持高精度的同时处理多样化文档格式。开发者可通过Hugging Face轻松集成，用于文档数字化、多语言信息提取或构建智能文档处理系统，特别适合处理表格、手写文字等复杂场景的实际应用。",
      "summary_en": "DeepSeek-OCR is a vision-language model that extracts and understands text from images, solving the challenge of converting visual text into machine-readable format. It combines transformer architecture with specialized OCR capabilities, enabling accurate text recognition across diverse layouts and languages. Developers can integrate it via Hugging Face pipelines for document digitization, multilingual text extraction, or building intelligent document processing systems that handle complex visual text scenarios with high precision.",
      "summary_zh": "DeepSeek-OCR 是一个先进的视觉语言模型，专门解决从图像中提取和理解文本的难题。它通过结合Transformer架构与优化的OCR技术，能够准确识别各种复杂布局和多语言文本。该模型采用端到端的视觉语言理解方法，在保持高精度的同时处理多样化文档格式。开发者可通过Hugging Face轻松集成，用于文档数字化、多语言信息提取或构建智能文档处理系统，特别适合处理表格、手写文字等复杂场景的实际应用。",
      "summary_es": "DeepSeek-OCR is a vision-language model that extracts and understands text from images, solving the challenge of converting visual text into machine-readable format. It combines transformer architecture with specialized OCR capabilities, enabling accurate text recognition across diverse layouts and languages. Developers can integrate it via Hugging Face pipelines for document digitization, multilingual text extraction, or building intelligent document processing systems that handle complex visual text scenarios with high precision.",
      "summary_short": {
        "zh": "DeepSeek-OCR 是一个先进的视觉语言模型，专门解决从图像中提取和理解文本的难题。它通过结合Transformer架构与优化的OCR技术，能够准确识别各种复杂布局和多语言文本。该模型采用端到端的视觉语言理解方法，在保持高精度的同时处理多样化文档格式。开发者可通过Hugging Face轻松集成，用于文档数字化、多语言信息提取或构建智能文档处理系统，特别适合处理表格、手写文字等复杂场景的实际应用。",
        "en": "DeepSeek-OCR is a vision-language model that extracts and understands text from images, solving the challenge of converting visual text into machine-readable format. It combines transformer architecture with specialized OCR capabilities, enabling accurate text recognition across…",
        "es": "DeepSeek-OCR is a vision-language model that extracts and understands text from images, solving the challenge of converting visual text into machine-readable format. It combines transformer architecture with specialized OCR capabilities, enabling accurate text recognition across…"
      },
      "tasks": [
        "multilingual_processing",
        "multimodal_understanding_generation",
        "text_to_image"
      ],
      "project_categories": [],
      "first_seen": "2025-11-04T03:00:23.596Z",
      "last_seen": "2025-11-04T03:00:23.596Z",
      "created_at": "2025-11-04T03:00:23.596Z",
      "updated_at": "2025-11-04T03:00:23.596Z",
      "score": 2057180,
      "score_model": 2057180,
      "score_task": 0.95,
      "reason_label": "tri",
      "reason_text": "LLM-qualified summary"
    }
  ]
}
