{
  "version": 1,
  "schema_version": 1,
  "pipeline_version": "v6",
  "date": "2025-10-24",
  "generated_at": "2025-10-24T02:53:44.500Z",
  "updated_at": "2025-10-24T02:53:44.500Z",
  "items": [
    {
      "id": "thedaviddias/Front-End-Checklist",
      "canonical_id": "github:thedaviddias/Front-End-Checklist",
      "source": "github",
      "status": "qualified",
      "name": "Front-End-Checklist",
      "url": "https://github.com/thedaviddias/Front-End-Checklist",
      "tags": [
        "checklist",
        "css",
        "front-end-developer-tool",
        "front-end-development",
        "frontend",
        "guidelines",
        "html",
        "javascript",
        "lists",
        "reference",
        "resources",
        "web-development"
      ],
      "stats": {
        "stars": 71559,
        "forks": 6591,
        "issues": 4
      },
      "summary": "Front-End-Checklist 是一个详尽的前端开发检查清单，帮助开发者系统性地验证现代网站的所有关键环节，避免生产环境中的常见疏漏。它通过将性能、安全、可访问性等复杂质量要求分解为结构化检查点，使质量保证过程变得清晰可控。开发者可在项目上线前将其作为审计工具集成到工作流中，根据具体需求定制检查项，或作为学习资源掌握行业最佳实践，从而构建更稳定、高效的Web应用。",
      "summary_en": "Front-End-Checklist is a comprehensive guide that helps developers systematically verify all critical aspects of modern web projects, preventing common oversights in production deployments. It organizes validation criteria into logical categories like performance, security, and accessibility, making complex quality assurance manageable through structured checkpoints. Developers can integrate it into their workflow as a pre-launch audit tool, customize it for specific project needs, or use it as an educational resource to learn industry best practices for robust web development.",
      "summary_zh": "Front-End-Checklist 是一个详尽的前端开发检查清单，帮助开发者系统性地验证现代网站的所有关键环节，避免生产环境中的常见疏漏。它通过将性能、安全、可访问性等复杂质量要求分解为结构化检查点，使质量保证过程变得清晰可控。开发者可在项目上线前将其作为审计工具集成到工作流中，根据具体需求定制检查项，或作为学习资源掌握行业最佳实践，从而构建更稳定、高效的Web应用。",
      "summary_es": "Front-End-Checklist is a comprehensive guide that helps developers systematically verify all critical aspects of modern web projects, preventing common oversights in production deployments. It organizes validation criteria into logical categories like performance, security, and accessibility, making complex quality assurance manageable through structured checkpoints. Developers can integrate it into their workflow as a pre-launch audit tool, customize it for specific project needs, or use it as an educational resource to learn industry best practices for robust web development.",
      "summary_short": {
        "zh": "Front-End-Checklist 是一个详尽的前端开发检查清单，帮助开发者系统性地验证现代网站的所有关键环节，避免生产环境中的常见疏漏。它通过将性能、安全、可访问性等复杂质量要求分解为结构化检查点，使质量保证过程变得清晰可控。开发者可在项目上线前将其作为审计工具集成到工作流中，根据具体需求定制检查项，或作为学习资源掌握行业最佳实践，从而构建更稳定、高效的Web应用。",
        "en": "Front-End-Checklist is a comprehensive guide that helps developers systematically verify all critical aspects of modern web projects, preventing common oversights in production deployments. It organizes validation criteria into logical categories like performance, security, and …",
        "es": "Front-End-Checklist is a comprehensive guide that helps developers systematically verify all critical aspects of modern web projects, preventing common oversights in production deployments. It organizes validation criteria into logical categories like performance, security, and …"
      },
      "tasks": [
        "tool_use"
      ],
      "project_categories": [
        "agents_workflows",
        "deployment_serving",
        "security_safety"
      ],
      "first_seen": "2025-10-24T02:52:43.389Z",
      "last_seen": "2025-10-24T02:52:43.389Z",
      "created_at": "2025-10-24T02:52:43.389Z",
      "updated_at": "2025-10-24T02:52:43.389Z",
      "score": 71559,
      "score_engineering": 71559,
      "score_category": 1,
      "reason_label": "tri",
      "reason_text": "LLM-qualified summary"
    },
    {
      "id": "nvidia/bigvgan_v2_22khz_80band_256x",
      "canonical_id": "huggingface:nvidia/bigvgan_v2_22khz_80band_256x",
      "source": "huggingface",
      "status": "qualified",
      "name": "bigvgan_v2_22khz_80band_256x",
      "url": "https://huggingface.co/nvidia/bigvgan_v2_22khz_80band_256x",
      "tags": [
        "PyTorch",
        "neural-vocoder",
        "audio-generation",
        "audio-to-audio",
        "arxiv:2206.04658",
        "license:mit",
        "region:us"
      ],
      "stats": {
        "downloads_total": 1872189,
        "likes_total": 21
      },
      "summary": "BigVGAN V2 是一款先进的神经声码器，能够从梅尔频谱生成高质量音频，解决了传统方法在语音和音乐合成中音质不足的问题。其核心技术在于采用大规模生成器架构和抗混叠多周期性判别器，通过对抗训练实现卓越的音频保真度和稳定性。开发者可通过Hugging Face上的PyTorch实现快速集成到文本转语音系统中，或基于自己的数据集进行微调来创建个性化的语音合成应用，为音频生成研究提供了强大的基础工具。",
      "summary_en": "BigVGAN V2 is a neural vocoder that generates high-fidelity audio from mel-spectrograms, solving the challenge of producing natural-sounding speech and music synthesis. Its key innovation lies in using a large-scale generator with anti-aliased multi-periodicity discriminators, enabling unprecedented audio quality and stability. Researchers can fine-tune it for custom voice generation or integrate it into text-to-speech pipelines using the provided PyTorch implementation on Hugging Face.",
      "summary_zh": "BigVGAN V2 是一款先进的神经声码器，能够从梅尔频谱生成高质量音频，解决了传统方法在语音和音乐合成中音质不足的问题。其核心技术在于采用大规模生成器架构和抗混叠多周期性判别器，通过对抗训练实现卓越的音频保真度和稳定性。开发者可通过Hugging Face上的PyTorch实现快速集成到文本转语音系统中，或基于自己的数据集进行微调来创建个性化的语音合成应用，为音频生成研究提供了强大的基础工具。",
      "summary_es": "BigVGAN V2 is a neural vocoder that generates high-fidelity audio from mel-spectrograms, solving the challenge of producing natural-sounding speech and music synthesis. Its key innovation lies in using a large-scale generator with anti-aliased multi-periodicity discriminators, enabling unprecedented audio quality and stability. Researchers can fine-tune it for custom voice generation or integrate it into text-to-speech pipelines using the provided PyTorch implementation on Hugging Face.",
      "summary_short": {
        "zh": "BigVGAN V2 是一款先进的神经声码器，能够从梅尔频谱生成高质量音频，解决了传统方法在语音和音乐合成中音质不足的问题。其核心技术在于采用大规模生成器架构和抗混叠多周期性判别器，通过对抗训练实现卓越的音频保真度和稳定性。开发者可通过Hugging Face上的PyTorch实现快速集成到文本转语音系统中，或基于自己的数据集进行微调来创建个性化的语音合成应用，为音频生成研究提供了强大的基础工具。",
        "en": "BigVGAN V2 is a neural vocoder that generates high-fidelity audio from mel-spectrograms, solving the challenge of producing natural-sounding speech and music synthesis. Its key innovation lies in using a large-scale generator with anti-aliased multi-periodicity discriminators, e…",
        "es": "BigVGAN V2 is a neural vocoder that generates high-fidelity audio from mel-spectrograms, solving the challenge of producing natural-sounding speech and music synthesis. Its key innovation lies in using a large-scale generator with anti-aliased multi-periodicity discriminators, e…"
      },
      "tasks": [],
      "project_categories": [],
      "first_seen": "2025-10-24T02:52:43.389Z",
      "last_seen": "2025-10-24T02:52:43.389Z",
      "created_at": "2025-10-24T02:52:43.389Z",
      "updated_at": "2025-10-24T02:52:43.389Z",
      "score": 1872189,
      "score_model": 1872189,
      "reason_label": "tri",
      "reason_text": "LLM-qualified summary"
    }
  ]
}
